ticket,reply,content_score,content_explanation,format_score,format_explanation
"Hi, I'd like to check the shipping status of my order #1234.","Sure, you can check your shipping status on our website. Your package is scheduled for delivery tomorrow.",5,The reply is relevant as it addresses the customer's inquiry about the shipping status of their order. It is accurate because it provides the correct information about the delivery date. The response is complete as it gives a specific date for delivery.,5,The reply is clear and well-structured with a simple and direct response format. It is grammatically correct without any errors.
"The product I received is defective. I'd like a refund, please.",We're sorry to hear that. Could you please provide a photo of the defect so we can proceed with the return process?,4,"The reply is relevant as it acknowledges the customer's issue and offers a solution. It is accurate in that the suggested action (providing a photo of the defect) is necessary for the return process. The response is not complete as it does not provide information about the next steps after receiving the photo, but it is sufficient for this initial interaction.",5,"The reply is clear and well-structured, with a polite tone. The grammar and syntax are correct."
I have a question about how to set up my new device. The instructions are not clear.,"Hello, thanks for contacting us. Please go to Settings > Advanced > Device Setup, and follow the steps. Let me know if you need further help.",4,"The reply provides a specific and relevant solution to the customer's problem, making it accurate and mostly complete.",5,"The response is clear, well-structured, and grammatically correct. The instructions are easy to follow."
"Hello, my account was charged twice. Could you help me fix that?",We've identified the issue and have requested a refund for the second charge. You should see the funds returned within 5-7 business days.,5,The reply is relevant as it addresses the customer's issue of double charging. It is accurate since it mentions a refund for the second charge and provides an estimated timeframe. The response is complete as it explains the steps taken to resolve the issue and the expected outcome.,5,"The reply is clear and well-structured, providing a straightforward solution to the customer's problem. It is grammatically correct with no errors."
I can't log into my account. It says 'invalid password' even though I'm sure it's correct.,Please reset your password using the 'Forgot Password' link. Let us know if you still encounter issues afterwards.,4,"The reply is relevant as it suggests a solution for the issue of being unable to log into an account due to an invalid password. It's accurate because resetting the password can indeed solve this problem. However, it could be more complete by providing additional steps or troubleshooting tips if the user still encounters issues after resetting the password.",5,"The reply is clear and well-structured, providing a simple step-by-step solution. It's also grammatically correct."
